{"_D":"urn:oasis:names:specification:ubl:schema:xsd:Manifest-2",
 "_A":"urn:oasis:names:specification:ubl:schema:xsd:CommonAggregateComponents-2",
 "_B":"urn:oasis:names:specification:ubl:schema:xsd:CommonBasicComponents-2",
 "Manifest":{
 "UBLVersionID":{"_":"2.3"},
 "CustomizationID":{"_":"urn:oasis:names:specification:ubl:xpath:ForwardingInstructions-2.0:samples-2.0-draft"},
 "ProfileID":{"_":"bpid:urn:oasis:names:draft:bpss:ubl-2-sample-international-scenario"},
 "ID":{"_":"KHN23-44048"},
 "UUID":{"_":"6E09886B-DC6E-439F-82D1-7C83709652B1"},
 "IssueDate":{"_":"2005-06-24"},
 "IssueTime":{"_":"14:20:00.0Z"},
 "SendingLogisticsOperatorParty":{
  "PartyName":[{
   "Name":{"_":"One-Stop Forwarders"}
  }],
  "PostalAddress":{
   "Postbox":{"_":"99043"},
   "CityName":{"_":"Boston"},
   "PostalZone":{"_":"02210"},
   "CountrySubentityCode":{"_":"MA"},
   "Country":{
    "IdentificationCode":{"_":"US"}
   }
  },
  "Contact":{
   "Name":{"_":"Con Solidador"},
   "Telephone":{"_":" +1 343 1453654"},
   "Telefax":{"_":"+1 343 1453655"},
   "ElectronicMail":{"_":"ctanner@onestopfreight.com"}
  }
 },
 "ConsignorParty":{
  "PartyName":[{
   "Name":{"_":"Consortial"}
  }],
  "PostalAddress":{
   "StreetName":{"_":"Boston Road"},
   "BuildingName":{"_":"Suite M-102"},
   "BuildingNumber":{"_":"630"},
   "CityName":{"_":"Billerica"},
   "PostalZone":{"_":"01821"},
   "CountrySubentity":{"_":"Massachusetts"},
   "CountrySubentityCode":{"_":"MA"},
   "Country":{
    "IdentificationCode":{"_":"US"}
   }
  },
  "Contact":{
   "Name":{"_":"Mrs Bouquet"},
   "Telephone":{"_":" +1 158 1233714"},
   "Telefax":{"_":"+ 1 158 1233856"},
   "ElectronicMail":{"_":"bouquet@fpconsortial.com"}
  }
 },
 "ConsigneeParty":{
  "PartyName":[{
   "Name":{"_":"IYT Corporation"}
  }],
  "PostalAddress":{
   "StreetName":{"_":"Avon Way"},
   "BuildingName":{"_":"Thereabouts"},
   "BuildingNumber":{"_":"56A"},
   "CityName":{"_":"Bridgtow"},
   "PostalZone":{"_":"ZZ99 1ZZ"},
   "CountrySubentity":{"_":"Avon"},
   "AddressLine":[{
    "Line":{"_":"3rd Floor, Room 5"}
   }],
   "Country":{
    "IdentificationCode":{"_":"GB"}
   }
  },
  "Contact":{
   "Name":{"_":"Mr Fred Churchill"},
   "Telephone":{"_":"+44 127 2653214"},
   "Telefax":{"_":"+44 127 2653215"},
   "ElectronicMail":{"_":"fred@iytcorporation.gov.uk"}
  }
 },
 "Shipment":{
  "ID":{"_":"CONS-0001"},
  "GrossWeightMeasure":{"_":130,
   "unitCode":"KGM"},
  "NetWeightMeasure":{"_":110,
   "unitCode":"KGM"},
  "NetNetWeightMeasure":{"_":100,
   "unitCode":"KGM"},
  "GrossVolumeMeasure":{"_":2,
   "unitCode":"MTQ"},
  "NetVolumeMeasure":{"_":2.235,
   "unitCode":"MTQ"},
  "TotalGoodsItemQuantity":{"_":1},
  "TotalTransportHandlingUnitQuantity":{"_":10},
  "InsuranceValueAmount":{"_":1000.00,
   "currencyID":"USD"},
  "DeclaredCustomsValueAmount":{"_":524.80,
   "currencyID":"GBP"},
  "FreeOnBoardValueAmount":{"_":1200.00,
   "currencyID":"USD"},
  "SpecialInstructions":[{"_":"Beeswax becomes liquid at 50'C"}],
  "Consignment":[{
   "ID":{"_":"CONS-0001"},
   "TariffDescription":[{"_":"Beeswax, other insect waxes and spermacetti"}],
   "TariffCode":{"_":"15219000"},
   "HazardousRiskIndicator":{"_":false},
   "ConsigneeParty":{
    "PartyName":[{
     "Name":{"_":"IYT Corporation"}
    }],
    "PostalAddress":{
     "StreetName":{"_":"Avon Way"},
     "BuildingName":{"_":"Thereabouts"},
     "BuildingNumber":{"_":"56A"},
     "CityName":{"_":"Bridgtow"},
     "PostalZone":{"_":"ZZ99 1ZZ"},
     "CountrySubentity":{"_":"Avon"},
     "AddressLine":[{
      "Line":{"_":"3rd Floor, Room 5"}
     }],
     "Country":{
      "IdentificationCode":{"_":"GB"}
     }
    },
    "Contact":{
     "Name":{"_":"Mr Fred Churchill"},
     "Telephone":{"_":"+44 127 2653214"},
     "Telefax":{"_":"+44 127 2653215"},
     "ElectronicMail":{"_":"fred@iytcorporation.gov.uk"}
    }
   },
   "NotifyParty":{
    "PartyName":[{
     "Name":{"_":"IYT Corporation"}
    }],
    "PostalAddress":{
     "StreetName":{"_":"Avon Way"},
     "BuildingName":{"_":"Thereabouts"},
     "BuildingNumber":{"_":"56A"},
     "CityName":{"_":"Bridgtow"},
     "PostalZone":{"_":"ZZ99 1ZZ"},
     "CountrySubentity":{"_":"Avon"},
     "AddressLine":[{
      "Line":{"_":"3rd Floor, Room 5"}
     }],
     "Country":{
      "IdentificationCode":{"_":"GB"}
     }
    },
    "Contact":{
     "Name":{"_":"Mr Fred Churchill"},
     "Telephone":{"_":"+44 127 2653214"},
     "Telefax":{"_":"+44 127 2653215"},
     "ElectronicMail":{"_":"fred@iytcorporation.gov.uk"}
    }
   },
   "FinalDeliveryParty":{
    "PartyName":[{
     "Name":{"_":"The Terminus"}
    }],
    "PostalAddress":{
     "StreetName":{"_":"Avon Way"},
     "BuildingName":{"_":"Thereabouts"},
     "BuildingNumber":{"_":"56A"},
     "CityName":{"_":"Bridgtow"},
     "PostalZone":{"_":"ZZ99 1ZZ"},
     "CountrySubentity":{"_":"Avon"},
     "AddressLine":[{
      "Line":{"_":"3rd Floor, Room 5"}
     }],
     "Country":{
      "IdentificationCode":{"_":"GB"}
     }
    },
    "Contact":{
     "Name":{"_":"S Massiah"},
     "Telephone":{"_":"+ 44 127 98876545"},
     "Telefax":{"_":"+ 44 127 98876546"},
     "ElectronicMail":{"_":"smassiah@the-email.co.uk"}
    }
   },
   "OriginalDepartureCountry":{
    "IdentificationCode":{"_":"US"}
   },
   "FinalDestinationCountry":{
    "IdentificationCode":{"_":"GB"}
   },
   "DeliveryTerms":{
    "ID":{"_":"FOB Destination"},
    "DeliveryLocation":{
     "ID":{"_":"GBBRS",
      "schemeAgencyID":"6",
      "schemeID":"UN/LOCODE"},
     "Description":[{"_":"Bristol"}]
    }
   },
   "FreightAllowanceCharge":[{
    "ChargeIndicator":{"_":true},
    "AllowanceChargeReason":[{"_":"Freight charges"}],
    "SequenceNumeric":{"_":1},
    "Amount":{"_":254.00,
     "currencyID":"USD"}
   },{
    "ChargeIndicator":{"_":false},
    "AllowanceChargeReasonCode":{"_":"79"},
    "AllowanceChargeReason":[{"_":"Sundry discount"}],
    "MultiplierFactorNumeric":{"_":0.05},
    "SequenceNumeric":{"_":2},
    "Amount":{"_":12.70,
     "currencyID":"USD"},
    "BaseAmount":{"_":254.00,
     "currencyID":"USD"}
   }]
  }],
  "GoodsItem":[{
   "ID":{"_":"1"},
   "SequenceNumberID":{"_":"1"},
   "Description":[{"_":"Acme beeswax"}],
   "HazardousRiskIndicator":{"_":false},
   "DeclaredCustomsValueAmount":{"_":524.80,
    "currencyID":"GBP"},
   "DeclaredStatisticsValueAmount":{"_":1000.00,
    "currencyID":"USD"},
   "FreeOnBoardValueAmount":{"_":1241.30,
    "currencyID":"USD"},
   "InsuranceValueAmount":{"_":1241.30,
    "currencyID":"USD"},
   "ValueAmount":{"_":1000.00,
    "currencyID":"USD"},
   "GrossWeightMeasure":{"_":130,
    "unitCode":"KGM"},
   "NetWeightMeasure":{"_":110,
    "unitCode":"KGM"},
   "NetNetWeightMeasure":{"_":100,
    "unitCode":"KGM"},
   "GrossVolumeMeasure":{"_":2,
    "unitCode":"MTQ"},
   "NetVolumeMeasure":{"_":2.235,
    "unitCode":"MTQ"},
   "Quantity":{"_":10},
   "RequiredCustomsID":{"_":"ECN12344566"},
   "CustomsStatusCode":{"_":"Cleared"},
   "CustomsTariffQuantity":{"_":100},
   "Item":[{
    "Description":[{"_":"Beeswax"}],
    "Name":{"_":"Acme Beeswax"},
    "BuyersItemIdentification":{
     "ID":{"_":"6578489"}
    },
    "SellersItemIdentification":{
     "ID":{"_":"17589683"}
    }
   }]
  }]
 },
 "DocumentReference":[{
  "ID":{"_":"234534533"},
  "DocumentType":[{"_":"CMR"}],
  "IssuerParty":{
   "PartyName":[{
    "Name":{"_":"Boston Road"}
   }]
  }
 },{
  "ID":{"_":"2343456533"},
  "DocumentType":[{"_":"CMR"}],
  "IssuerParty":{
   "PartyName":[{
    "Name":{"_":"Boston Road"}
   }]
  }
 },{
  "ID":{"_":"XD534533"},
  "DocumentType":[{"_":"BOL"}],
  "IssuerParty":{
   "PartyName":[{
    "Name":{"_":"Maersk"}
   }]
  }
 }]
}}